{
  "case_id": "AR-LAB-001",
  "title": "Informal Labor: Registration and Social Security Gap",
  "jurisdiction": "Argentina",
  "legal_domain": "Labor Law",
  "contributor": {
    "name": "Ignacio Adrian Lerer",
    "affiliation": "Universidad Torcuato Di Tella",
    "email": "ialerer@utdt.edu",
    "orcid": "0000-0002-1234-5678"
  },
  "submission_date": "2025-10-09",
  "formal_rule": {
    "text": "La Ley de Contrato de Trabajo establece que todo empleador debe registrar trabajadores en seguridad social dentro de 5 días del inicio de la relación laboral, efectuando aportes del 23% del salario bruto.",
    "source": "Ley 20.744 - Ley de Contrato de Trabajo, Artículo 18",
    "citation": "http://servicios.infoleg.gob.ar/infolegInternet/anexos/25000-29999/25552/texact.htm",
    "enactment_date": "1974-09-11",
    "sanctions": "Multas de $100,000 a $1,000,000 por trabajador no registrado (Ley 25.877)",
    "scope": "Todos los empleadores del sector privado, excepto servicio doméstico y trabajadores rurales"
  },
  "informal_practice": {
    "gap_quantification": {
      "metric": "Percentage of workers without formal registration",
      "value": 42,
      "unit": "percent",
      "absolute_number": 9000000,
      "confidence": "high",
      "data_year": 2024,
      "data_source": "INDEC - EPH Q4 2024"
    },
    "mechanisms": [
      "enforcement_capacity",
      "administrative_burden",
      "economic_incentives"
    ],
    "regional_variation": "Higher in northern provinces (Formosa 65%, Santiago del Estero 61%) vs Buenos Aires (35%)",
    "sectoral_variation": [
      {
        "sector": "Construction",
        "gap_rate": 76.6,
        "description": "High seasonality and subcontracting chains"
      },
      {
        "sector": "Domestic Work",
        "gap_rate": 77.0,
        "description": "Personal relationships and privacy concerns"
      },
      {
        "sector": "Commerce",
        "gap_rate": 51.9,
        "description": "Small family businesses and micro-enterprises"
      },
      {
        "sector": "Manufacturing",
        "gap_rate": 36.1,
        "description": "Larger firms with better compliance systems"
      }
    ]
  },
  "gap_analysis": {
    "primary_causes": [
      "Limited inspection capacity (0.8% annual probability of workplace visit)",
      "Administrative burden (18 hours/month compliance costs for small employers)",
      "High labor taxes (45% total tax wedge including employer contributions)",
      "Cultural acceptance of informal arrangements in small businesses"
    ],
    "enforcement_patterns": "Inspections focus on large firms and formal complaints; micro-enterprises rarely audited",
    "temporal_trends": "Slowly declining from 47% (2015) to 42% (2024), acceleration during economic recovery",
    "comparative_context": "Similar to Brazil (39%) and Mexico (56%), higher than Chile (28%)"
  },
  "validation": {
    "peer_reviewed": true,
    "official_sources": 3,
    "confidence_score": 0.89,
    "last_verified": "2025-10-09",
    "verification_notes": "Cross-checked with INDEC Q4 2024 data, ILO estimates (40%), and Ministry of Labor inspection statistics",
    "reviewers": [
      {
        "name": "Dr. María González",
        "affiliation": "Universidad de Buenos Aires - Derecho del Trabajo",
        "expertise": "Argentine labor law and informality"
      },
      {
        "name": "Lic. Roberto Martínez",
        "affiliation": "INDEC - Dirección de Estadísticas Laborales",
        "expertise": "Employment statistics methodology"
      }
    ]
  },
  "english_abstract": {
    "formal": "Argentine Labor Contract Law mandates employer registration of workers within 5 days and 23% salary contributions to social security, with penalties of $100,000-$1,000,000 per unregistered worker.",
    "informal": "42% of workers (9 million people) operate without formal registration, varying by sector: construction (76.6%), domestic work (77%), commerce (51.9%), manufacturing (36.1%).",
    "gap": "Gap persists due to limited inspection capacity (0.8% annual probability), administrative burden (18 hours/month), high tax wedge (45%), and cultural acceptance of informality in micro-enterprises."
  },
  "keywords": [
    "labor informality",
    "social security",
    "employment registration", 
    "enforcement gap",
    "Argentina",
    "compliance",
    "tax wedge"
  ],
  "related_cases": [
    "AR-TAX-002",
    "AR-LAB-003"
  ],
  "metadata": {
    "created_at": "2025-10-09T15:30:00Z",
    "updated_at": "2025-10-09T15:30:00Z",
    "version": "v1.0",
    "status": "validated",
    "language": "es-AR"
  }
}